<?xml version="1.0" encoding="UTF-8"?>

<request
    xmlns:xsi='http://www.w3.org/2001/XMLSchema-instance'
    xsi:noNamespaceSchemaLocation='APIRequest.xsd'>
    <!--Пример запроса на регистрацию-->
    <registration>
        <name>YuriPanasenco</name>
        <mail>Panasenco@outlook.com</mail>
        <hashPass>12345</hashPass>
    </registration>
    
    <!--Пример запроса на авторизацию-->
    <authorization>
        <name>ebtb</name>
        <hashPass>sdfvrf</hashPass>
    </authorization>
        
    <!--пример запроса на создание цели-->
    <createGoal>
        <sessionId>tnlekmgregreko54ymn6oyh5k4my</sessionId>
        <name>Название цели</name>
        <anotation>Краткое описание цели</anotation>
        <beginDate>07.09.2016</beginDate>
        <endDate>01.07.2018</endDate>
        <plan>
            <item>
                <number>1</number>
                <name>Получить высшее образование (Уровень бакалавр)</name>
                <beginDate>01.09.2016</beginDate>
                <endDate>01.07.2018</endDate>
            </item>
            <item>
                <number>2</number>
                <name>Накопить 5 тыс. доларов</name>
                <beginDate>01.09.2016</beginDate>
                <endDate>01.07.2018</endDate>
                <idAcount>4</idAcount>
            </item>
        </plan>
    </createGoal>

    <!--пример запроса на закрытие сесии-->
    <closeSession>
        <sessionId>tnlekmgregreko54ymn6oyh5k4my</sessionId>
    </closeSession>
    
    <!--пример запроса на получение информации о пользователе-->
    <userState>
        <sessionId>tnlekmgregreko54ymn6oyh5k4my</sessionId>
    </userState>
    
    <!--пример запроса на получение списка пользовательских целей-->
    <userGoals>
        <sessionId>tnlekmgregreko54ymn6oyh5k4my</sessionId>
    </userGoals>
    
    <!--пример запроса на получение отчета по конкретной цели-->
    <goalInfo>
        <sessionId>tnlekmgregreko54ymn6oyh5k4my</sessionId>
        <golaID>234</golaID>
    </goalInfo>
    
    
    
    
    
    <!--Пример запроса для подтверждения регистрации-->
    <confirmation>
        <sessionId>tnlekmgregreko54ymn6oyh5k4my</sessionId>
        <key>uijonuhibjonot6f5ft7</key>
    </confirmation>
    <!--пример запроса на содание плана на завтра-->
<!--    <createPlanToDay>
        <date>04.09.2016</date>дата на когда создается план
        <plan>
            <item>
                <number>1</number>
                <name>Задание 1</name>
                <status>Begin</status>
                <globalPlan>
                    <numberGoal>1</numberGoal>
                    <numberItemPlan>2</numberItemPlan>
                </globalPlan>
            </item>
            <item>
                <number>2</number>
                <name>Задание 2</name>
                <status>Begin</status>
            </item>
        </plan>
    </createPlanToDay>-->
    
    
    
    <palnToDay>
        <sessionId>tnlekmgregreko54ymn6oyh5k4my</sessionId>
    </palnToDay>
    
</request>
